{
  "$schema": "https://json-schema.org/draft/2020-12/schema",
  "$id": "https://specs.omes.ahliweb.com/provenance/v1/release-manifest.schema.json",
  "title": "ReleaseManifest",
  "description": "Release manifest and artifact inventory (ADR-0010, issues #168, #173).",
  "type": "object",
  "required": [
    "schema_version",
    "version",
    "tag",
    "commit_sha",
    "release_date",
    "repository",
    "artifacts"
  ],
  "additionalProperties": false,
  "properties": {
    "schema_version": {
      "type": "string",
      "enum": ["1.0.0"]
    },
    "version": {
      "type": "string",
      "pattern": "^[0-9]+\\.[0-9]+\\.[0-9]+(-[a-zA-Z0-9.]+)?$"
    },
    "tag": {
      "type": "string",
      "pattern": "^v[0-9]+\\.[0-9]+\\.[0-9]+(-[a-zA-Z0-9.]+)?$"
    },
    "commit_sha": {
      "type": "string",
      "pattern": "^[0-9a-f]{40}$"
    },
    "release_date": {
      "type": "string",
      "pattern": "^[0-9]{4}-[0-9]{2}-[0-9]{2}(T[0-9]{2}:[0-9]{2}:[0-9]{2}Z)?$"
    },
    "repository": {
      "type": "string"
    },
    "artifacts": {
      "type": "array",
      "items": {
        "type": "object",
        "required": [
          "filename",
          "sha256",
          "size_bytes",
          "content_type"
        ],
        "additionalProperties": false,
        "properties": {
          "filename": {
            "type": "string"
          },
          "sha256": {
            "type": "string",
            "pattern": "^[0-9a-f]{64}$"
          },
          "size_bytes": {
            "type": "integer",
            "minimum": 0
          },
          "content_type": {
            "type": "string"
          }
        }
      }
    }
  }
}
